Title,Author,URL,Number of Comments,Upvotes,Text Content
AskScience AMA Series: I'm a Researcher Using AI to Predict Brain Injury Recovery - Ask Me Anything!,AskScienceModerator,https://www.reddit.com/r/askscience/comments/1793bwf/askscience_ama_series_im_a_researcher_using_ai_to/,62,202,"Hello, I'm Adrian Owen, a neuroscientist and researcher from Western University in London, Ontario, and my team has been working on a groundbreaking project using artificial intelligence to predict brain injury recovery.

Our recent research study has been featured ⁠[Journal of Neurology](https://link.springer.com/article/10.1007/s00415-023-11941-6), and I'm here to answer all your questions about this exciting development. We've made significant strides in understanding and forecasting recovery outcomes for brain injury patients, predicting patients who would recover with an accuracy of 80 per cent. Whether you're curious about the technology, its potential impact or the research process, ask away!

Link to the article: [Read more here](https://news.westernu.ca/2023/09/ai-predict-brain-injury-recovery/)

I'll be on starting at **noon ET (16 UT)**, ask me anything!

Username: /u/ProfAdrianOwen"
