Title,Author,URL,Number of Comments,Upvotes,Text Content
"AskScience AMA Series: We are statisticians in cancer research, sports analytics, data journalism, and more, here to answer your questions about how statistics opens doors for exciting careers. Ask us anything!",AskScienceModerator,https://www.reddit.com/r/askscience/comments/gyx8mf/askscience_ama_series_we_are_statisticians_in/,264,2715,"Statistics isn't what you think it is! With a career in statistics, the science of learning from data, you can change the world, have fun, satisfy curiosity and make a good salary. Demand for statisticians is on the rise, and careers in statistics are consistently on best jobs lists. Best of all, statistics applies to just about any field, so you can apply it to a wide range of personal passions. Just ask our real-life statisticians to learn more about the opportunities!

The [panelists](https://pbs.twimg.com/media/EZ_rLihWoAAFi-a?format=jpg&name=large) include:  

+ [Olivia Angiuli](https://www.signalfire.com/human/olivia-angiuli/) - Research scientist at SignalFire; former Ph.D. student in statistics at UC Berkeley; former data scientist at Quora
+ [Rafael Irizarry](https://www.hsph.harvard.edu/rafael-irizarry/) - Applied statistician performing cancer research as professor and chair of the Department of Data Science at Dana-Farber Cancer Institute, professor at Harvard University, and co-founder of [SimplyStatistics.org](https://simplystatistics.org/)
+ [Sheldon Jacobson](http://shj.cs.illinois.edu/) - Founder professor of computer science, founding director of the Institute for Computational Redistricting,  founding director of the Bed Time Research Institute, and founder of Bracket Odds at the University of Illinois at Urbana-Champaign [Research Institute](http://btri.cs.illinois.edu/), and founder of Bracket Odds at the University of Illinois at Urbana-Champaign 
+ [Liberty Vittert](https://olin.wustl.edu/EN-US/Faculty-Research/Faculty/Pages/FacultyDetail.aspx?username=liberty.vittert) - TV, radio and print news contributor (including BBC, Fox News Channel, Newsweek and more), professor of the practice of data science at the Olin Business School at the Washington University; associate editor for the Harvard Data Science Review, board member of board of USA for the UN Refugee Agency (UNHCR) and the HIVE. 
+ [Nathan Yau](https://flowingdata.com/about-nathan/) - Author of Visualize This and Data Points, and founder of [FlowingData.com](https://flowingdata.com/). 

We will be available at noot ET (16 UT), ask us anything!

Username: ThisIsStatisticsASA"
