Title,Author,URL,Number of Comments,Upvotes,Text Content
What are the current limitations of desalination plants globally?,MrTigeriffic,https://www.reddit.com/r/askscience/comments/8xa49t/what_are_the_current_limitations_of_desalination/,524,3558,"A quick google search shows that the cost of desalination plants is huge. A brief post here explaining cost [https://www.quora.com/How-much-does-a-water-desalination-plant-cost](https://www.quora.com/How-much-does-a-water-desalination-plant-cost)

With current temperatures at record heights and droughts effecting farming crops and livestock where I'm from (Ireland) other than cost, what other limitations are there with desalination?

Or

Has the technology for it improved in recent years to make it more viable?

Edit: grammer"
