Title,Author,URL,Number of Comments,Upvotes,Text Content
How To Become A Good Wellness Coach,stainsted,https://www.reddit.com/r/Fitness/comments/5yg1ls/how_to_become_a_good_wellness_coach/,0,1,"By Deborah Hughes
   
   
Wellness defines a lot of meanings based on the person you are talking to. Many health coaches help and support clients to change their lifestyle and diet. The key components of coaching are to listen and understand how they define wellness as it is a vital aspect in making a plan and improve their life. Actually, some coaches also act as a nutritionist and a personal trainer.
   
   
 However, not every nutritionist and trainer is a wellness coach. The difference usually depends on the approaches they will use in achieving the personal goals of their clients. Trainers are hired to give motivation, guidance, and education to attain certain goals. The same goes to a nutritionist. He or she is trained to offer information, help, and design a plan to make the process successful. Basically, a [Wellness Coach Houston](http://ift.tt/2etgU8c) will use various practices to fit the needs of every client.
   
   
 Moreover, there are specific opportunities for sharing education and information. But the primary focus of any coach is to help a person achieve his or her long term goals. This is not the same as telling what to do. The process involves discussing their goals while designing a plan to achieve the targets together.
   
   
 Good coaches will ask essential questions about the background of their clients. This way, they are able to re enforce important reasons to make a good lifestyle plan rather than telling them what to do to make better changes. A good instructor will also help you obtain the goals and keep you motivated all the time. Typically, the quality of conversation that trainers are coaches have are not the same.
   
   
 Most of the coaches operate their own business. They usually market themselves, present a coaching that will benefit their services, and draw from their personal experience and background. Typically, a coaching expert works with a client in the field of exercise, nutrition, stress management, and weight control and areas of relationships and life balance.
   
   
 If you are interested in the field, it would be best to determine what training has to be done. Define the difference between nutritionists and trainers. Basically, there is no requirement for an individual to label a private business as coaching. Always remember that there are no particular laws that require certain certification to call themselves as an instructor in most areas.
   
   
 The starting points may involve stress management, an exercise physiology, and a foundation in nutrition. These things are necessary to become a good instructor. It would be best to take a certified training program to understand all aspects pf communication. Typically, there are many programs available with different emphasis, so be sure to find one that suits you.
   
   
 A lot of people assume that wellness coaches are part time counselor, part time advisor, a teacher, and even a part nagging mother. Sometimes, instructors play those responsibilities but they are only secondary to what trainers really do. Even if the entire coaching industry is not licensed, it is basically an outstanding profession.
   
   
 Make sure to understand that health coaching is not a replacement for therapies. Recommendations and other suggestions are not intended to replace the advice of any medical specialists. People may choose these coaches when they want changes in their lifestyle to live a happy and better life. But if there are medical conditions, it would be best to choose a medical specialist.
   
   

   

   

   
 About the Author:
   

   
If you are looking for information about a [wellness coach Houston](http://ift.tt/2etgU8c) residents can come to our web pages online today. More details are available at http://ift.tt/2etgU8c now.
   

   
   
   
 from physical exercise http://ift.tt/2m3Wrbf
   
   
 via [IFTTT](http://ift.tt/1gYSBZM)"
