Title,Author,URL,Number of Comments,Upvotes,Text Content
Fantasies Hollywood movies sold us on?,JuniXe,https://www.reddit.com/r/movies/comments/10rq7yi/fantasies_hollywood_movies_sold_us_on/,82,16,"Fun thread intended, not a real critique.

I'll start!

Main character-character's parents are always unbelievably young looking, fit and attractive and it's just normal.

Average people live comfortably in astronomically high priced locations and cities.

A random cop has perfectly coiffed hair on the job.

The good guy walks to face off the bad guy from the left, and the bad guy on the right. 

People in poverty are played by actors who received great nutrition, dental care and college educations."
