Title,Author,URL,Number of Comments,Upvotes,Text Content
What's the saddest song MELODY/MUSIC you've heard?,NextComplexTopo,https://www.reddit.com/r/Music/comments/17nu8tu/whats_the_saddest_song_melodymusic_youve_heard/,52,6,"Piggybacking on the recent post about the saddest songs you've heard (lyrics presumed) give me some songs I can cry to without caring about the lyrics! Here's a couple from me:

Bell X1- I'll see your heart and raise you mine

Cat Power-I found a reason

Jason Isbell-Cover me up

Jaymay-Big Ben

The Shins-It's only life

EDIT: formatting "
